{
  "apiVersion": "modos.pleiades/v1alpha1",
  "artifacts": [
    {
      "artifactId": "source:seed-snapshot",
      "bytes": 1857,
      "digest": "sha256:c6d6c8c57be7e694f2ad1ff930167bfdc9466a085c88e0dfc6d3e694699ba761",
      "locator": "modos/ontology/fixtures/seed-snapshot.json",
      "role": "source-snapshot",
      "visibility": "public"
    },
    {
      "artifactId": "proposal:link-workspace",
      "bytes": 1028,
      "digest": "sha256:1b6c08eb2f031d8486785b4b7c9f22744973156326ff8fe5c0435538073d1681",
      "locator": "modos/ontology/fixtures/link-workspace.proposal.json",
      "role": "change-proposal",
      "visibility": "public"
    },
    {
      "artifactId": "candidate:expected-snapshot",
      "bytes": 1980,
      "digest": "sha256:188cf5b330b3aba64ff0901c28acb0c64f6c9d69af8ff8a17ee71f7719e83e21",
      "gitBlobSha": "15b6acd664c2921cd8c79bea079b33c3b05aad39",
      "locator": "modos/ontology/fixtures/expected-candidate-snapshot.json",
      "role": "candidate-snapshot",
      "visibility": "public"
    },
    {
      "artifactId": "receipt:expected-closure",
      "bytes": 1865,
      "digest": "sha256:ffd26496cb3ff775cf4e5f50eaa4ded220bbeabd28f330e75ffb8ae5df6e831c",
      "gitBlobSha": "59a8ac35a2a205cd8bc01e998584c12e23343f30",
      "locator": "modos/ontology/fixtures/expected-closure-receipt.json",
      "role": "closure-receipt",
      "visibility": "public"
    },
    {
      "artifactId": "compiler:ontology-0.1.0",
      "bytes": 18095,
      "digest": "sha256:cda01acce3afac4c970c18f6710c4cadd41cda078df71aa07da97d5c3b02ddca",
      "gitBlobSha": "dc177f086fc373aecf527c467ecd5e2cc1695612",
      "locator": "modos/ontology/compiler.py",
      "role": "compiler",
      "visibility": "public"
    },
    {
      "artifactId": "contract:ontology-snapshot",
      "bytes": 1228,
      "digest": "sha256:580da729ee10475897b627b2448eba8ebcaed6134f1f010bb4f88565017191c7",
      "gitBlobSha": "2b62f0a1ad67a6ea37bff9c2710c0bbe80808e4d",
      "locator": "modos/contracts/ontology-snapshot.schema.json",
      "role": "contract",
      "visibility": "public"
    }
  ],
  "authority": {
    "ceiling": "none",
    "pathAuthority": "evidence-only",
    "selfPromotionAllowed": false
  },
  "branch": "ontology/proposal-compiler-boundary-v1",
  "commitSha": "18503ad22e01c1ab2461b4397fa9c5052ed121c3",
  "kind": "OntologySourceManifest",
  "manifestId": "manifest:ontology-pr-52-head-18503ad2",
  "mindId": "mind:pleiades",
  "repository": "Zheke32174/pleiades",
  "schemaVersion": "v1alpha1",
  "subject": {
    "candidateSnapshotDigest": "sha256:fb24a0a0c1394fc8f4a45df9e68eb5d8ed9a3e849882c19ff0b743ffd8202196",
    "closureReceiptDigest": "sha256:7e4bc0216488af205339cc0a59b1eb4de5bc435be46d1e9b8dbb7aa263b64487",
    "sourceSnapshotDigest": "sha256:6cdb735ccdd132b7c86a7f60df6f953138f3555bfc362708947f7a8f5832ea51"
  }
}
